{
  "asserted_value": null,
  "evidence_id": "01a0c450-6c04-7315-ba60-a50147e6ed63",
  "evidence_kind": "documentation",
  "fact_id": "01a0c450-6c02-7b8e-8d45-e4d9f0d1ad1c",
  "fact_kind": "entity",
  "field_path": null,
  "id": "01a0c450-6c03-754a-ad80-09bf8decd7b1",
  "org_id": "01a0c450-6c01-76c4-8c39-8171fd4953d6",
  "revision_from": 1,
  "revision_to": null
}
